Question Type,Study,Question,Expected Answer
Data Discovery,All Studies,How many studies are in cBioPortal?,497 studies
Cohort Statistics,msk_chord_2024,How many patients and samples are in the MSK-CHORD Study?,"24,950 Patients and 25,040 samples"
Clinical Data,msk_chord_2024,How many primary samples are in the MSK-CHORD Study?,"15,928 primary samples"
Treatment,msk_chord_2024,What is treatment did most patients receive in the MSK-CHORD Study?,Fluorouracil
Genomic Alteration Frequencies,os_target_gdc,What are the top 5 most frequently mutated genes in the Osteosarcoma study from TARGET?,"TP53 22.4%, MUC16 11.2%, TTN 11.2%, ATRX 7.7%, DNAH9 7.0%"
Genomic Alteration Frequencies,os_target_gdc,What are the top 5 most frequently copy number altered genes in the Osteosarcoma study from TARGET?,
Genomic Alteration Frequencies,os_target_gdc,What are the top 5 most frequently altered genes in a structural variant in the Osteosarcoma study from TARGET?,
Genomic Alteration Frequencies,os_target_gdc,"What are the top 5 frequelntly altered genes in the Osteosarcoma study from TARGET for mutations, copy numbers and SVs combined?",